abbrev,bibtype,doi,url,arxiv_url,year,month,publisher,volume,number,pages,author,title,journal,code
fdapy_2021,article,10.48550/arXiv.2101.11003,,https://doi.org/10.48550/arXiv.2101.11003,2021,jan,,,,,Steven Golovkine,FDApy: a Python package for functional data,,https://github.com/StevenGolovkine/FDApy
smoothness_2022,article,10.1214/22-EJS1997,https://doi.org/10.1214/22-EJS1997,https://doi.org/10.48550/arXiv.2009.03652,2022,jan,Institute of Mathematical Statistics and Bernoulli Society,16,1,1485-1560,Steven Golovkine and Nicolas Klutchnikoff and Valentin Patilea,Learning the smoothness of noisy curves with application to online curve estimation,Electronic Journal of Statistics,https://github.com/StevenGolovkine/denoisr
fcubt_2022,article,10.1016/j.csda.2021.107376,https://doi.org/10.1016/j.csda.2021.107376,https://doi.org/10.48550/arXiv.2012.05973,2022,apr,Elsevier,168,,,Steven Golovkine and Nicolas Klutchnikoff and Valentin Patilea,Clustering multivariate functional data using unsupervised binary trees,Computational Statistics & Data Analysis,https://github.com/StevenGolovkine/fcubt
mean_covariance_2023,article,10.48550/arXiv.2108.06507,,https://doi.org/10.48550/arXiv.2108.06507,2023,jul,,,,,Steven Golovkine and Nicolas Klutchnikoff and Valentin Patilea,Adaptive estimation of irregular mean and covariance functions,,https://github.com/StevenGolovkine/funestim
gram_2023,article,10.48550/arXiv.2306.12949,,https://doi.org/10.48550/arXiv.2306.12949,2023,jun,,,,,Steven Golovkine and Edward Gunning and Andrew J. Simpkin and Norma Bargary,On the use of the Gram matrix for multivariate functional principal components analysis,,https://github.com/FAST-ULxNUIG/geom_mfpca
